{
  "title": "Dos movimientos que marcaron Wall Street",
  "language": "es",
  "narration": "Dos acciones concentraron la atencion del cierre. NVIDIA avanzo un 4,8 por ciento despues de elevar su prevision anual de ingresos. Tesla cedio un 3,2 por ciento tras una contraccion del margen automotriz. Manana, el foco estara en si ambos movimientos mantienen volumen durante la apertura.",
  "movers": [
    {
      "ticker": "NVDA",
      "company": "NVIDIA",
      "direction": "up",
      "changePct": 4.8,
      "catalyst": "La compania elevo su prevision anual de ingresos.",
      "sourceIds": ["src-nvda-market", "src-nvda-release"]
    },
    {
      "ticker": "TSLA",
      "company": "Tesla",
      "direction": "down",
      "changePct": -3.2,
      "catalyst": "El mercado reacciono a una contraccion del margen automotriz.",
      "sourceIds": ["src-tsla-market", "src-tsla-filing"]
    }
  ],
  "closing": "Vigila el volumen de apertura y cualquier nueva comunicacion corporativa. Esto no es asesoramiento financiero."
}
